iddrink,strdrink,stralcoholic,strcategory,strglass,strinstructions
12796,Caribbean Orange Liqueur,Alcoholic,Homemade Liqueur,Collins Glass,"Pare very thinly the bright-colored rind from the oranges (no white). Blot the peel on paper towels to remove any excess oil. Put peel in a 4 cup screw-top jar. Add 2 cups vodka. Close jar. Store in a cool, dark place for 2 days or until the vodka has absorbed the flavor. Remove peel and add remaining vodka. Close jar and add remaining cup of vodka. Close the jar and store in a cool dark place at least 1 month to age."
14752,Kiwi Lemon,Alcoholic,Ordinary Drink,Highball glass,Mix in highball glass. Stirr. Garnish with slice of kiwi.
12214,Singapore Sling,Alcoholic,Ordinary Drink,Hurricane glass,Pour all ingredients into cocktail shaker filled with ice cubes. Shake well. Strain into highball glass. Garnish with pineapple and cocktail cherry.
16082,Almond Chocolate Coffee,Alcoholic,Ordinary Drink,Coffee mug,Pour in order into coffee cup. Top with whipped creme and chocolate shcvings.
14466,Dirty Nipple,Alcoholic,Shot,Shot glass,This is a layered shot - the Bailey's must be on top
13060,Margarita,Alcoholic,Ordinary Drink,Cocktail glass,"Rub the rim of the glass with the lime slice to make the salt stick to it. Take care to moisten only the outer rim and sprinkle the salt on it. The salt should present to the lips of the imbiber and never mix into the cocktail. Shake the other ingredients with ice, then carefully pour into the glass."
17211,Dark and Stormy,Alcoholic,Ordinary Drink,Highball glass,In a highball glass filled with ice add 6cl dark rum and top with ginger beer. Garnish with lime wedge.
11025,Amaretto And Cream,Alcoholic,Ordinary Drink,Cocktail glass,"Shake well with cracked ice, strain contents into a cocktail glass, and serve."
17824,The Laverstoke,Alcoholic,Cocktail,Balloon Glass,"1) Squeeze two lime wedges into a balloon glass then add the cordial, Bombay Sapphire and MARTINI Rosso Vermouth, swirl to mix.

2) Fully fill the glass with cubed ice and stir to chill.

3) Top with Fever-Tree Ginger Ale and gently stir again to combine.

4) Garnish with a snapped ginger slice and an awoken mint sprig."
17178,Jam Donut,Alcoholic,Shot,Shot glass,"Coat the rim of a shot glass with sugar using sugar syrup to stick. Add the Chambord raspberry liqueur to the shot glass, and carefully layer the Baileys Irish Cream on top. Serve."
11224,Casino Royale,Alcoholic,Ordinary Drink,Whiskey sour glass,"In a shaker half-filled with ice cubes, combine all of the ingredients. Shake well. Strain into a sour glass."
12862,Aloha Fruit punch,Non alcoholic,Punch / Party Drink,Collins Glass,"Add 1/4 cup water to ginger root. Boil 3 minutes. Strain. Add the liquid to the guava, lemon and pineapple juices. Make a syrup of sugar and remaining water. Cool. Combine with juices and pineapple. Chill throroughly."
17174,Cherry Electric Lemonade,,Cocktail,Pint glass,Now stir vigorously and then pour over a large cup of ice. Now drink it with a straw and stir occasionally.
12744,Microwave Hot Cocoa,Non alcoholic,Cocoa,Coffee mug,"Combine sugar, cocoa, salt and hot water in 1-quart micro-proof measuring cup (or coffee mug). Microwave at HIGH (100%) for 1 to 1 1/2 minutes or until boiling. Add milk, sitr and microwave an additonal 1 1/2 to 2 minutes or until hot. Stir in vanilla, blend well."
15515,Tennesee Mud,Alcoholic,Coffee / Tea,Coffee Mug,"Mix Coffee, Jack Daniels and Amaretto. Add Cream on top."
11106,Blackthorn,Alcoholic,Ordinary Drink,Cocktail glass,Stir sloe gin and vermouth with ice and strain into a cocktail glass. Add the twist of lemon peel and serve.
16951,Kioki Coffee,Alcoholic,Coffee / Tea,Coffee mug,Stir. Add whipped cream to the top.
17185,Casino,Alcoholic,Ordinary Drink,Cocktail glass,Pour all ingredients into shaker with ice cubes. Shake well. Strain into chilled cocktail glass. Garnish with a lemon twist and a maraschino cherry. Serve without a straw.
11001,A Night In Old Mandalay,Alcoholic,Ordinary Drink,Highball glass,"In a shaker half-filled with ice cubes, combine the light rum, añejo rum, orange juice, and lemon juice. Shake well. Strain into a highball glass almost filled with ice cubes. Top with the ginger ale. Garnish with the lemon twist."
17248,French Negroni,Alcoholic,Cocktail,Martini Glass,"1. Add ice to a shaker and pour in all ingredients.
2. Using a bar spoon, stir 40 to 45 revolutions or until thoroughly chilled.
3. Strain into a martini glass or over ice into a rocks glass. Garnish with orange twist."
11470,Havana Cocktail,Alcoholic,Ordinary Drink,Cocktail glass,"In a shaker half-filled with ice cubes, combine all of the ingredients. Shake well. Strain into a cocktail glass."
12772,Iced Coffee Fillip,Alcoholic,Coffee / Tea,Coffee mug,Mix together in a coffee mug and chill before serving.
15951,Black Forest Shake,Alcoholic,Milk / Float / Shake,Collins Glass,"In a blender put ice cubes, chocolate syrup, cherry brandy, vodka, and milk. Blend very well."
13020,Sangria #1,Alcoholic,Punch / Party Drink,Pitcher,Mix all together in a pitcher and refrigerate. Add cloves and cinnamon sticks to taste. Serve in wine glasses.
17191,Planter's Punch,Alcoholic,Punch / Party Drink,Collins glass,"Pour all ingredients, except the bitters, into shaker filled with ice. Shake well. Pour into large glass, filled with ice. Add Angostura bitters, ""on top"". Garnish with cocktail cherry and pineapple."
12764,Karsk,Alcoholic,Ordinary Drink,Highball glass,"Put a copper coin in a coffe-cup and fill up with coffee until you no longer see the coin, then add alcohol until you see the coin. Norwegian speciality."
11016,Brandy Alexander,Alcoholic,Ordinary Drink,Cocktail glass,Shake all ingredients (except nutmeg) with ice and strain contents into a cocktail glass. Sprinkle nutmeg on top and serve.
13625,Screaming Orgasm,Alcoholic,Ordinary Drink,Cocktail glass,"Pour first vodka, then Bailey's, then Kahlua into a cocktail glass over crushed ice. Stir. Caution: use only high quality vodka. Cheap vodka can cause the Bailey's to curdle. Test your brand of vodka by mixing 1 Tsp each of vodka and Bailey's first."
11006,Adam,Alcoholic,Ordinary Drink,Cocktail glass,"In a shaker half-filled with ice cubes, combine all of the ingredients. Shake well. Strain into a cocktail glass."
16984,Radioactive Long Island Iced Tea,Alcoholic,Ordinary Drink,Collins Glass,Pour all ingredients over ice in a very tall glass. Sip cautiously.
15691,Zoksel,Alcoholic,Soft Drink / Soda,Beer pilsner,"No specific mixinginstructions, just poor every ingredient in one glass. The lemon goes with it."
12198,Sidecar Cocktail,Alcoholic,Ordinary Drink,Cocktail glass,"Shake all ingredients with ice, strain into a cocktail glass, and serve."
16995,Orange Whip,Alcoholic,Other/Unknown,Collins Glass,Pour ingredients over ice and stir.
14888,Zinger,Alcoholic,Soft Drink / Soda,Highball glass,Get a shot glass and pour in three shots of the schnapps. Do the same with the Surge Cola. Then down it like Scheetz would.
11113,Bloody Mary,Alcoholic,Ordinary Drink,Old-fashioned glass,"Stirring gently, pour all ingredients into highball glass. Garnish."
12780,Spiking coffee,Non alcoholic,Coffee / Tea,Coffee mug,"Incidentally, a pinch of cinnamon is indeed a nice addition to coffee but true heaven is a cardamom seed. Of course, you serve it in a coffee mug."
11382,Frisco Sour,Alcoholic,Ordinary Drink,Whiskey sour glass,Shake all ingredients (except slices of lemon and lime) with ice and strain into a whiskey sour glass. Decorate with the slices of lemon and lime and serve.
11462,Harvey Wallbanger,Alcoholic,Ordinary Drink,Collins glass,"Stir the vodka and orange juice with ice in the glass, then float the Galliano on top. Garnish and serve."
12436,Van Vleet,Alcoholic,Ordinary Drink,Old-fashioned glass,"Shake all ingredients with ice, strain into an old-fashioned glass over ice cubes, and serve."
11164,Brandy Flip,Alcoholic,Ordinary Drink,Whiskey sour glass,"In a shaker half-filled with ice cubes, combine the brandy, egg, sugar, and cream. Shake well. Strain into a sour glass and garnish with the nutmeg."
11668,Long Island Tea,Alcoholic,Ordinary Drink,Highball glass,Combine all ingredients (except cola) and pour over ice in a highball glass. Add the splash of cola for color. Decorate with a slice of lemon and serve.
17226,Adam & Eve,Alcoholic,Cocktail,Cocktail glass,Shake together all the ingredients and strain into a cold glass.
14272,Addison Special,Alcoholic,Cocktail,Old-fashioned glass,Combine ingredients in the order listed into a shaker. Fill half full with ice and shake well. Strain into glass with ice and garnish with a cherry and orange wedge.
15761,Quick-sand,Alcoholic,Ordinary Drink,Highball glass,"Simply add the orange juice, quite a quick pour in order to mix the sambucca with the orange juice. The juice MUST have fruit pulp!"
11014,Alexander,Alcoholic,Ordinary Drink,Cocktail glass,Shake all ingredients with ice and strain contents into a cocktail glass. Sprinkle nutmeg on top and serve.
17207,Pina Colada,Alcoholic,Ordinary Drink,Collins glass,"Mix with crushed ice in blender until smooth. Pour into chilled glass, garnish and serve."
16942,Zipperhead,Alcoholic,Shot,Whiskey sour glass,"Fill glass with rocks, add straw before putting in liquor. Then add the ingredients in order, trying to keep layered as much as possible (i.e. Chambord on bottom, then Vodka, Then soda on top)."
11420,Gin Toddy,Alcoholic,Ordinary Drink,Old-fashioned glass,"Mix powdered sugar and water in an old-fashioned glass. Add gin and one ice cube. Stir, add the twist of lemon peel, and serve."
13683,Apple Slammer,Alcoholic,Shot,Shot glass,"pour into a shot glass and present to consumer, they are expected to cover the top of the shotglass with thier palm, raise the glass, slam it on the bar and the swallow quickly."
12754,Sex on the Beach,Alcoholic,Ordinary Drink,Highball glass,Build all ingredients in a highball glass filled with ice. Garnish with orange slice.
11119,Blue Mountain,Alcoholic,Ordinary Drink,Old-fashioned glass,"In a shaker half-filled with ice cubes, combine all of the ingredients. Shake well. Strain into an old-fashioned glass alomst filled with ice cubes."
11251,City Slicker,Alcoholic,Ordinary Drink,Cocktail glass,"In a shaker half-filled with ice cubes, combine all of the ingredients. Shake well. Strain into a cocktail glass."
12446,Veteran,Alcoholic,Ordinary Drink,Old-fashioned glass,Pour the rum and cherry brandy into an old-fashioned glass almost filled with ice cubes. Stir well.
11720,Martinez Cocktail,Alcoholic,Cocktail,Cocktail glass,Stir all ingredients (except cherry) with ice and strain into a cocktail glass. Top with the cherry and serve.
14560,A.D.M. (After Dinner Mint),Alcoholic,Cocktail,Irish coffee cup,shake vigorously
12760,Surf City Lifesaver,Alcoholic,Ordinary Drink,Highball glass,Lots of ice and soda top up in tall glass with cherry and a grin.
12442,Vermouth Cassis,Alcoholic,Ordinary Drink,Highball glass,"Stir vermouth and creme de cassis in a highball glass with ice cubes. Fill with carbonated water, stir again, and serve."
12688,Just a Moonmint,Non alcoholic,Milk / Float / Shake,Highball Glass,"Place all ingredients in the blender jar - cover and whiz on medium speed until well blended. Pour in one tall, 2 medium or 3 small glasses and drink up."
13775,Jelly Bean,Alcoholic,Shot,Cordial glass,mix equal parts in pony glass-tastes just like a jelly bean!
13395,Bob Marley,Alcoholic,Shot,Shot glass,Layer in a 2 oz shot glass or pony glass
11965,Port Wine Flip,Alcoholic,Ordinary Drink,Whiskey sour glass,Shake all ingredients (except nutmeg) with ice and strain into a whiskey sour glass. Sprinkle nutmeg on top and serve.
14730,Bubble Gum,Alcoholic,Shot,Shot glass,Layer in order into a shot glass.
13377,Sea breeze,Alcoholic,Ordinary Drink,Highball glass,Build all ingredients in a highball glass filled with ice. Garnish with lime wedge.
11566,Jewel Of The Nile,Alcoholic,Ordinary Drink,Cocktail glass,"In a mixing glass half-filled with ice cubes, combine all of the ingredients. Stir well. Strain into a cocktail glass."
14956,Jello shots,Alcoholic,Shot,Shot glass,"Boil 3 cups of water then add jello. Mix jello and water until jello is completely disolved. Add the two cups of vodka and mix together. Pour mixture into plastic shot glasses and chill until firm. Then, eat away..."
12722,Strawberry Shivers,Non alcoholic,Other/Unknown,Highball glass,"Place all ingredients in the blender jar - cover and whiz on medium speed until well blended. Pour in one tall, 2 medium or 3 small glasses and drink up."
16031,Radler,Alcoholic,Ordinary Drink,Highball glass,"Pour beer into large mug, slowly add the 7-up (or Sprite)."
12308,Stone Sour,Alcoholic,Ordinary Drink,Whiskey sour glass,"Shake all ingredients with ice, strain into a chilled whiskey sour glass, and serve."
17219,Yellow Bird,Alcoholic,Cocktail,Cocktail glass,Shake and strain into a chilled cocktail glass
14133,Cosmopolitan Martini,Alcoholic,Cocktail,Cocktail Glass,"Pour all ingredients in mixing glass half filled with ice, shake and strain into chilled Martini glass."
14446,Kool-Aid Slammer,Alcoholic,Shot,Shot glass,"Fill half the shot glass with the kool-aid first. Then put a paper towel over the top of the glass and slowly pour in the vodka. If you do it right, you should be able to see that the two liquids are separated, with the vodka on top. Now slam it! The last thing you'll taste is the kool-aid."
14029,'57 Chevy with a White License Plate,Alcoholic,Cocktail,Highball glass,1. Fill a rocks glass with ice 2.add white creme de cacao and vodka 3.stir
13058,Wine Punch,Alcoholic,Punch / Party Drink,Collins Glass,Combine all of the ingredients and pour over a block of ice.
14456,Kurant Tea,Alcoholic,Coffee / Tea,Champagne flute,"Pour Absolut Kurant into a comfortably big tea-cup. Add the not too hot(!) apple tea and, if you like, some sugar. Enjoy!"
17255,Gimlet,Alcoholic,Cocktail,Martini Glass,"Add all the ingredients to a shaker and fill with ice.

Shake, and strain into a chilled cocktail glass or an Old Fashioned glass filled with fresh ice.

Garnish with a lime wheel."
16943,A Gilligan's Island,Alcoholic,Cocktail,Collins glass,"Shaken, not stirred!"
12758,Gagliardo,Alcoholic,Cocktail,Cocktail glass,"Shake well and serve in a cocktail glass. This is a home cocktail of American/Internet Bar del Pozzo, Pavia, Italy."
17209,Barracuda,Alcoholic,Ordinary Drink,Margarita glass,"Shake pour ingredients with ice. Strain into glass, top with Sparkling wine."
12370,Tequila Sour,Alcoholic,Ordinary Drink,Whiskey sour glass,"Shake tequila, juice of lemon, and powdered sugar with ice and strain into a whiskey sour glass. Add the half-slice of lemon, top with the cherry, and serve."
11002,A. J.,Alcoholic,Ordinary Drink,Cocktail glass,"Shake ingredients with ice, strain into a cocktail glass, and serve."
12954,Holloween Punch,Non alcoholic,Punch / Party Drink,Punch bowl,"Take a bunch of grape juice and a bunch of fizzy stuff (club soda, ginger ale, lemonlime, whatever). Mix them in a punch bowl. Take orange sherbet and lime sherbet. Scoop out scoops and float them in the punch, let them melt a little so that a nasty film spreads all over the top of the punch but there are still ""bubbles"" in it in the form of sherbet scoops. Looks horrible, tastes just fine."
12800,Coffee-Vodka,Alcoholic,Homemade Liqueur,Collins Glass,"Boil water and sugar until dissolved. Turn off heat. Slowly add dry instant coffee and continue stirring. Add a chopped vanilla bean to the vodka, then combine the cooled sugar syrup and coffee solution with the vodka. Cover tightly and shake vigorously each day for 3 weeks. Strain and filter. Its also best to let the sugar mixture cool completely so the vodka won't evaporate when its added. If you like a smoother feel to the liqueur you can add about 1 teaspoon of glycerine to the finished product."
17141,Smut,Alcoholic,Punch / Party Drink,Beer mug,Throw it all together and serve real cold.
17254,Bijou,Alcoholic,Cocktail,Cocktail glass,"Stir in mixing glass with ice and strain
"
17268,Blue Hurricane,Alcoholic,Cocktail,Highball glass,"If each part is 1/2 oz then use about 2.5 cups of ice.

Blend it all together. 
Drink it with a big straw if you have one.

"
12388,Thriller,Alcoholic,Ordinary Drink,Cocktail glass,"In a shaker half-filled with ice cubes, combine all of the ingredients. Shake well. Strain into a cocktail glass."
17005,A True Amaretto Sour,Alcoholic,Cocktail,Old-fashioned glass,"Rub the rim of an old fashioned glass with lemon, and dip repeatedly into granulated sugar until it has a good ""frosted"" rim. Shake a jigger of Amaretto with the juice of 1/2 a lemon. Strain into glass and add ice. Garnish with a Marachino Cherry."
17213,French Martini,Alcoholic,Cocktail,Cocktail glass,Pour all ingredients into shaker with ice cubes. Shake well and strain into a chilled cocktail glass. Squeeze oil from lemon peel onto the drink.
11019,Alfie Cocktail,Alcoholic,Ordinary Drink,Cocktail glass,"Combine and shake all ingredients with ice, strain into a cocktail glass, and serve."
11528,Irish Spring,Alcoholic,Ordinary Drink,Collins glass,"Pour all ingredients (except orange slice and cherry) into a collins glass over ice cubes. Garnish with the slice of orange, add the cherry on top, and serve."
16262,H.D.,Alcoholic,Coffee / Tea,Beer mug,Mix the whisky and Baileys Cream in a beer-glass (at least 50 cl). Fill the rest of the glass with coffee.
11728,Martini,Alcoholic,Cocktail,Cocktail glass,"Straight: Pour all ingredients into mixing glass with ice cubes. Stir well. Strain in chilled martini cocktail glass. Squeeze oil from lemon peel onto the drink, or garnish with olive."
11416,Gin Smash,Alcoholic,Ordinary Drink,Old-fashioned glass,"Muddle sugar with carbonated water and mint sprigs in an old-fashioned glass. Add gin and 1 ice cube. Stir, add the orange slice and the cherry, and serve."
17183,Bacardi Cocktail,Alcoholic,Ordinary Drink,Cocktail glass,Shake together with ice. Strain into glass and serve.
11149,Boxcar,Alcoholic,Ordinary Drink,Whiskey sour glass,"In a shaker half-filled with ice cubes, combine all of the ingredients. Shake well. Strain into a sour glass."
15813,Herbal flame,Alcoholic,Coffee / Tea,Mason jar,"Pour Hot Damn 100 in bottom of a jar or regular glass. Fill the rest of the glass with sweet tea. Stir with spoon, straw, or better yet a cinnamon stick and leave it in."
13282,Black & Tan,Alcoholic,Beer,Pint glass,Fill pint glass half full with Bass. Next pour Guiness over a spoon slowly until glass is full. If done correctly the Guiness will stay on top and the Bass on bottom hence the name Black & Tan.
15178,Texas Rattlesnake,Alcoholic,Shot,Highball glass,"Mix all ingredients and Shake well. Sweet at first, with a BITE at the end..."
12162,Screwdriver,Alcoholic,Ordinary Drink,Highball glass,Mix in a highball glass with ice. Garnish and serve.
12774,Masala Chai,Non alcoholic,Coffee / Tea,Coffee Mug,Bring 2 cups of water to boil. Add all the ingredients and boil again for about 15 seconds. Let stand for a minute. Warm milk in a pot. Filter tea into cups. Add milk and sugar. That's IT.
11403,Gin And Tonic,Alcoholic,Ordinary Drink,Highball glass,Pour the gin and the tonic water into a highball glass almost filled with ice cubes. Stir well. Garnish with the lime wedge.
16295,Bleeding Surgeon,Alcoholic,Soft Drink / Soda,Collins glass,"Pour Shot of Rum over slice of orange. Fill the remaining space in glass half way full of surge or similar drink. Finish off glass with cranberry juice. Be carefull, warm surge may foam over the glass."
15194,Amaretto Shake,Alcoholic,Ordinary Drink,Collins Glass,Combine all ingredients in a blender and blend at high speed until smooth. Serve in chilled glass garnished with bittersweet chocolate shavings.
12668,Egg Cream,Non alcoholic,Other/Unknown,Coffee mug,"Mix syrup and milk in a fountain glass. Add soda water, serve with a straw."
17176,Ipamena,Non Alcoholic,Ordinary Drink,Wine Glass,"Cut half a lime into pieces, place in a shaker, add the sugar and crush. Measure the passion fruit juice, add it to the shaker and fill up with ice cubes. Close the shaker and shake vigorously. Pour the liquid into a glass, top up with ginger ale, stir with a teaspoon and then garnish the rim of the glass with a slice of lime"
11324,Dry Rob Roy,Alcoholic,Ordinary Drink,Cocktail glass,"In a mixing glass half-filled with ice cubes, combine the Scotch and vermouth. Stir well. Strain into a cocktail glass. Garnish with the lemon twist."
14229,747,Alcoholic,Shot,Shot glass,"pour kaluha, then Baileys, then Frangelico not chilled and not layered -- SERVE!!!"
15841,Mojito #3,Alcoholic,Cocktail,Collins glass,"Put mint with lemon juice in a glas, mash the mint with a spoon, ice, rum & fill up with club soda. Top it with Angostura."
11396,Gentleman's Club,Alcoholic,Ordinary Drink,Old-fashioned glass,"In an old-fashioned glass almost filled with ice cubes, combine all of the ingredients. Stir well."
13070,Fahrenheit 5000,Alcoholic,Shot,Shot glass,Cover bottom of shot glass with Tabasco Sauce and then fill with half Firewater and half Absolut Peppar.
15933,Zambeer,Alcoholic,Soft Drink / Soda,Collins Glass,Mix sambuca with rootbeer and stir. Add ice
12716,Mango Orange Smoothie,Non alcoholic,Other/Unknown,Highball Glass,Throw everything into a blender and liquify.
12696,Lassi - Sweet,Non alcoholic,Other/Unknown,Highball glass,Put all ingredients into a blender and blend until nice and frothy. Serve chilled.
12672,Fruit Flip-Flop,Non alcoholic,Other/Unknown,Highball Glass,"Place all ingredients in the blender jar - cover and whiz on medium speed until well blended. Pour in one tall, 2 medium or 3 small glasses and drink up."
15853,B-52,Alcoholic,Shot,Shot glass,Layer ingredients into a shot glass. Serve with a stirrer.
17233,Salted Toffee Martini,Alcoholic,Cocktail,Cocktail glass,"Add ice, toffee gin, chocolate liqueur and Amaretto to a cocktail shaker and shake vigorously. 
Pour the chocolate syrup into a saucer and dip the top of a martini glass into the sauce. Grate some of the Willie\'s sea salt chocolate into another saucer and dip the coated glass, so the flakes stick to the sauce, creating a chocolate rim!
Pour the contents of the shaker into your chocolatey glass and sprinkle with more grated chocolate - enjoy!  "
16158,Whitecap Margarita,Alcoholic,Other/Unknown,Margarita/Coupette glass,Place all ingredients in a blender and blend until smooth. This makes one drink.
12190,Sherry Flip,Alcoholic,Ordinary Drink,Nick and Nora Glass,Shake all ingredients (except nutmeg) with ice and strain into a whiskey sour glass. Sprinkle nutmeg on top and serve.
11658,Loch Lomond,Alcoholic,Ordinary Drink,Cocktail glass,"In a mixing glass half-filled with ice cubes, combine the Scotch, Drambuie, and vermouth. Stir well. Strain into a cocktail glass. Garnish with the lemon twist."
12746,Nuked Hot Chocolate,Non alcoholic,Cocoa,Coffee mug,"Mix with a bit of milk (1 oz or so) in coffee mug. Nuke mug for about 30-50 seconds. Stir until the heated cocoa dissolves. Fill mug with milk. Nuke for 1-2 minutes, depending on wattage and preferences as to burnt mouth parts."
12692,Lassi Khara,Non alcoholic,Other/Unknown,Highball Glass,Blend (frappe) in blender until frothy. Add torn curry leaves and serve cold.
17210,Bramble,Alcoholic,Ordinary Drink,Old-Fashioned glass,"Fill glass with crushed ice. Build gin, lemon juice and simple syrup over. Stir, and then pour blackberry liqueur over in a circular fashion to create marbling effect. Garnish with two blackberries and lemon slice."
14598,50/50,Alcoholic,Ordinary Drink,Collins Glass,fill glass with crushed ice. Add vodka. Add a splash of grand-marnier. Fill with o.j.
16275,Jack's Vanilla Coke,Alcoholic,Other/Unknown,Old-fashioned glass,"After pouring in your ingredients, and adding 3-5 ice cubes, according to taste. Stir the drink with a stirrer to get the Vanilla off the bottom."
11959,Poppy Cocktail,Alcoholic,Ordinary Drink,Cocktail glass,"Shake ingredients with ice, strain into a cocktail glass, and serve."
13751,Cuba Libra,Alcoholic,Ordinary Drink,Highball glass,Fill tall glass with ice cubes. Add rum. Rub cut edge of lime on rim of glass then squeeze juice into glass. Fill with Coca-Cola. Garnish with lime slice. Enjoy!
12726,Tomato Tang,Non alcoholic,Other/Unknown,Highball glass,"Place all ingredients in the blender jar - cover and whiz on medium speed until well blended. Pour in one tall, 2 medium or 3 small glasses and drink up."
11424,Godmother,Alcoholic,Ordinary Drink,Old-fashioned glass,Pour vodka and amaretto into an old-fashioned glass over ice and serve.
12057,Royal Gin Fizz,Alcoholic,Ordinary Drink,Highball glass,"Shake all ingredients (except carbonated water) with ice and strain into a highball glass over two ice cubes. Fill with carbonated water, stir, and serve."
15521,Swedish Coffee,Alcoholic,Coffee / Tea,Coffee Mug,Pour the coffee in an ordinary coffee cup. Add the aquavit. Add sugar by taste. Stir and have a nice evening (morning)
11000,A Furlong Too Late,Alcoholic,Ordinary Drink,Highball glass,Pour the rum and ginger beer into a highball glass almost filled with ice cubes. Stir well. Garnish with the lemon twist.
12786,Thai Iced Tea,Non alcoholic,Coffee / Tea,Highball glass,"Combine Thai tea (i.e., the powder), boiling water, and sweetened condensed milk, stir until blended. Pour into 2 tall glasses filled with ice cubes. Garnish with mint leaves. Makes 2 servings."
13162,Afternoon,Alcoholic,Coffee / Tea,Collins Glass,"Build into a suiting glass, with no ice. Cream on top if wanted. Served directly."
17247,The Last Word,Alcoholic,Cocktail,Cocktail glass,Shake with ice and strain into a cocktail glass.
13190,Kool-Aid Shot,Alcoholic,Shot,Old-fashioned glass,Pour into a large glass with ice and stir. Add a little cranberry juice to taste.
