iddrink,strdrink,stralcoholic,strcategory,strglass,strinstructions
14071,Belgian Blue,Alcoholic,Soft Drink / Soda,Highball glass,Just pour all ingredients in the glass and stir...
17246,Empellón Cocina's Fat-Washed Mezcal,Alcoholic,Cocktail,Beer Glass,"To ensure that your pork fat is just as delicious as theirs, here’s their adobo marinade and what to do with it (you’ll also need a rack of ribs):

4 ancho chiles, 8 guajillo chiles and 4 chipotle chiles, plus 4 cloves roasted garlic, half a cup of cider vinegar, a quarter teaspoon of Mexican oregano, 1 teaspoon of ground black pepper, a whole clove, a quarter teaspoon of ground cinnamon and a half teaspoon of ground cumin.

Toast the dried chiles and soak in water for at least an hour until they are rehydrated. Drain and discard the soaking liquid. Combine the soaked chiles with the remaining ingredients and purée until smooth.

Cold smoke a rack of baby back pork ribs by taking a large hotel pan with woodchips on one side and charcoal on the other. Place another, smaller, pan with pork ribs, above the charcoal/woodchip pan. Ignite the charcoal, being careful to not ignite the woodchips. Cover both pans with foil and allow to smoke for 10-15 minutes, until desired level of smoke is achieved, then coat with adobo marinade and wrap in tin foil prior to placing ribs in a 300 degree oven for 7 hours. When the ribs have cooled, strain off the fat and use for the infusion.

If you’re having a hard time coming up to the same kind of volume of fat, make up the balance with pork lard from a butcher. To get the same depth of flavor without the ribs, heat up the fat in a pot with a few spoons of the marinade.

Once you’ve got your tub of seasoned pork fat in cooled liquid form, pour equal amounts of Ilegal Joven mezcal and fat into a sealable container. Seal the container and give it a really good shake, then put it in the freezer overnight. When the whole thing is separated and congealed, pour it through a fine mesh chinoise. If you don’t have a chinoise, try a fine mesh strainer, or if you don’t have one of those, try spooning off most of the fat. There will be some beads of orange fat left in the strained mezcal: run that through a few layers of cheesecloth (or coffee filters in a pinch) to get rid of the last of it.

The mezcal is now ready for drinking, straight-up or in a cocktail. 

Habanero tincture

Slice habaneros and add 2 ounces Ilegal Joven mezcal.
Allow to sit overnight or until desired level of heat is achieved.
Cocktail

Combine mezcal and chocolate liqueur in a mixing glass with ice and stir for 45 seconds.
Strain into chilled coupe.
Carefully ""sink"" the coffee liqueur down the inside of the coupe over a spoon.
Garnish with 5 drops habanero tincture."
14564,A Splash of Nash,Alcoholic,Shot,Highball glass,Drop shot glass with banana & melon liquers into a 9 oz hi- ball glass containing soda water and cranberry juice. Drink in one shot.
17187,Derby,Alcoholic,Ordinary Drink,Cocktail glass,Pour all ingredients into a mixing glass with ice. Stir. Strain into a cocktail glass. Garnish with a sprig of fresh mint in the drink.
17193,Stinger,Alcoholic,Ordinary Drink,Cocktail glass,"Pour in a mixing glass with ice, stir and strain into a cocktail glass. May also be served on rocks in a rocks glass."
12752,Lemon Shot,Alcoholic,Shot,Shot glass,"Mix Galliano and Absolut Citron in a shot glass, lay lemon wedge sprinkled with sugar over glass and pour a rum over wedge and glass. light rum with a lighter and let burn for a second. Do shot quickly and suck on lemon. If it is done correctly, this will taste like a shot of sweet lemonade."
11064,Banana Daiquiri,Alcoholic,Ordinary Drink,Champagne flute,Pour all ingredients into shaker with ice cubes. Shake well. Strain in chilled cocktail glass.
15395,1-900-FUK-MEUP,Alcoholic,Shot,Old-fashioned glass,Shake ingredients in a mixing tin filled with ice cubes. Strain into a rocks glass.
12756,Autodafé,Alcoholic,Ordinary Drink,Highball glass,Mix and fill up with soda water. Drunk by finns on a sunny day any time of the year and day.
15106,Apello,Non alcoholic,Other/Unknown,Collins Glass,Stirr. Grnish with maraschino cherry.
17225,Ace,Alcoholic,Cocktail,Martini Glass,Shake all the ingredients in a cocktail shaker and ice then strain in a cold glass.
11407,Gin Cooler,Alcoholic,Ordinary Drink,Collins glass,Stir powdered sugar and 2 oz. carbonated water in a collins glass. Fill glass with ice and add gin. Fill with carbonated water and stir. Add the lemon peel and the orange spiral so that the end of the orange spiral dangles over rim of glass.
17208,Rose,Alcoholic,Ordinary Drink,Cocktail glass,"Shake together in a cocktail shaker, then strain into chilled glass. Garnish and serve."
12130,Scooter,Alcoholic,Ordinary Drink,Cocktail glass,"Shake all ingredients well with cracked ice, strain into a cocktail glass, and serve."
12654,Banana Milk Shake,Non alcoholic,Milk / Float / Shake,White wine glass,"Blend very well, preferably in a household mixer. Serve in a wine glass, garnish with whipped cream and a piece of banana."
14195,Snowball,Alcoholic,Ordinary Drink,Highball glass,Place one ice cube in the glass and add 1 1/2 oz of Advocaat. Fill up the glass with lemonade and decorate with a slice of lemon. Serve at once.
14107,Absolut Summertime,Alcoholic,Cocktail,Collins glass,Add all ingredients except lemon to shaker filled with ice. Cover and shake vigorously. Strain contents into ice filled collins glass. Garnish with lemon.
13499,Oreo Mudslide,Alcoholic,Ordinary Drink,Collins Glass,"Blend Vodka, Kahlua, Bailey's, ice-cream and the Oreo well in a blender. Pour into a large frosted glass. Garnish with whipped cream and a cherry."
12518,Whisky Mac,Alcoholic,Ordinary Drink,Collins Glass,Pour both of the ingredients into a wine goblet with no ice.
12802,Cranberry Cordial,Alcoholic,Homemade Liqueur,Collins Glass,"Place the chopped cranberries in a 2 liter jar that has a tight-fitting lid. Add the sugar and rum. Adjust the lid securely and place the jar in a cool, dark place. Invert the jar and shake it every day for six weeks. Strain the cordial into bottles and seal with corks."
14374,Absolut Evergreen,Alcoholic,Other/Unknown,Collins Glass,"Mix, pour over ice and top up with Bitter Lemon."
12808,Creme de Menthe,Alcoholic,Homemade Liqueur,Collins Glass,Bring sugar and water to a boil and simmer for 10 minutes. Cool. Add the remaining ingredients and stir. Cover and let ripen for 1 month.
17267,Bahama Mama,Alcoholic,Cocktail,Highball glass,"Add 2 parts club soda or more or less to taste.

Mix it all together and pour over a bunch of ice. Drink with a straw."
12768,Frappé,Non alcoholic,Coffee / Tea,Highball Glass,"Mix together. Blend at highest blender speed for about 1 minute. Pour into a glass and drink with a straw. Notes: This works best if everything is cold (if you make fresh coffee, mix it with the milk and let it sit in the fridge for 1/2 hour. If it is not frothy, add more milk, or even just some more milk powder. The froth gradually turns to liquid at the bottom of the glass, so you will find that you can sit and drink this for about 1/2 hour, with more iced coffee continually appearing at the bottom. Very refreshing."
12732,Chocolate Beverage,Non alcoholic,Cocoa,Coffee mug,"Boil milk in the top of a deep double boiler five minutes. Remove from fire and add chocolate, mixed with the cinnamon, a little at a time, beating with molinillo or egg beater after each addition. When the chocolate is thoroughly blended, heat to the boiling point. Place over bottom of double boiler and add eggs, whipping constantly, until they are thoroughly blended and the mixture is frothing. Serve in coffee mug. Serves eight."
12322,Strawberry Margarita,Alcoholic,Ordinary Drink,Cocktail glass,"Rub rim of cocktail glass with lemon juice and dip rim in salt. Shake schnapps, tequila, triple sec, lemon juice, and strawberries with ice, strain into the salt-rimmed glass, and serve."
14622,Arctic Fish,Alcoholic,Punch / Party Drink,Beer pilsner,"Fill glass with ice and fish, add vodka, grape soda and orange juice. DO NOT STIR!!!!! Serve well chilled."
14602,Tequila Surprise,Alcoholic,Shot,Shot glass,Fill shot glass with Tequila. Add drops of Tobasco sauce.
13731,Amaretto Sour,Alcoholic,Ordinary Drink,Collins Glass,Shake and strain. Garnish with a cherry and an orange slice.
12450,Victor,Alcoholic,Ordinary Drink,Cocktail glass,"Shake all ingredients with ice, strain into a cocktail glass, and serve."
11417,Gin Sour,Alcoholic,Ordinary Drink,Whiskey sour glass,"In a shaker half-filled with ice cubes, combine the gin, lemon juice, and sugar. Shake well. Strain into a sour glass and garnish with the orange slice and the cherry."
11558,Japanese Fizz,Alcoholic,Ordinary Drink,Highball glass,"Shake all ingredients (except carbonated water) with ice and strain into a highball glass over two ice cubes. Fill with carbonated water, stir, and serve."
15184,San Francisco,Alcoholic,Ordinary Drink,Highball glass,"Take a tall glass and put in a few ice cubes, fill the vodka over it and fill with juice then the ""creme"", to end fill in the grenadine but very carefully at the side of the glass so it will lay down in the bottom. garnish with orange and strawberry."
16271,The Evil Blue Thing,Alcoholic,Cocktail,Old-fashioned glass,"Pour ingredients into glass, and drop in a blue whale! The blue whale isn't really necessary, but it makes the drink more ""fun""."
16176,Bellini Martini,Alcoholic,Ordinary Drink,Cocktail glass,"Add ice cubes to shaker.
Add vodka.
Add peach schnapps.
Add peach nectar.
Shake.
Strain into glass.
Add lemon twist peel."
15026,Kiss me Quick,Alcoholic,Ordinary Drink,Highball glass,mix in the glass
12618,Orangeade,Non alcoholic,Cocktail,Highball glass,"Place some ice cubes in a large tumbler or highball glass, add lemon juice, orange juice, sugar syrup, and stir well. Top up with cold soda water, serve with a drinking straw."
17224,Absolutely Fabulous,Alcoholic,Cocktail,Champagne flute,Mix the Vodka and Cranberry juice together in a shaker and strain into a glass. Top up with Champagne.
12630,Rail Splitter,Non alcoholic,Cocktail,Highball glass,Mix sugar syrup with lemon juice in a tall glass. Fill up with ginger ale.
13621,Tequila Sunrise,Alcoholic,Cocktail,Highball glass,"Pour the tequila and orange juice into glass over ice. Add the grenadine, which will sink to the bottom. Stir gently to create the sunrise effect. Garnish and serve."
12820,Irish Cream,Alcoholic,Homemade Liqueur,Irish coffee cup,Mix scotch and milk. Add half-and-half. Add rest.
14608,Cream Soda,Alcoholic,Cocktail,Highball glass,Pour 1oz of Spiced Rum into a highball glass with ice. Fill with Ginger Ale.
15092,Pysch Vitamin Light,Non alcoholic,Ordinary Drink,Collins Glass,Shake with ice.
11872,Orgasm,Alcoholic,Ordinary Drink,Cocktail glass,"Shake all ingredients with ice, strain into a chilled cocktail glass, and serve."
15086,Limona Corona,Alcoholic,Beer,Beer Glass,"Open the Corona. Fill the empty space in the neck in the bottle with the rum. The bottle should be filled to the top. Plug the bottle with your thumb or the palm of your hand. Turn the bottle upside-down so the rum and beer mix. Turn the bottle rightside-up, unplug, and drink."
17197,French 75,Alcoholic,Ordinary Drink,Collins glass,"Combine gin, sugar, and lemon juice in a cocktail shaker filled with ice. Shake vigorously and strain into a chilled champagne glass. Top up with Champagne. Stir gently."
11983,Quaker's Cocktail,Alcoholic,Ordinary Drink,Cocktail glass,"Shake all ingredients with ice, strain into a cocktail glass, and serve."
13807,After Five,Alcoholic,Shot,Shot glass,"1. Pour Kahlua into shot glass to about 1/2 full. 2. Using a spoon(inverted), slowly pour in the Peppermint Schnapps until glass is about 3/4 full. Done correctly, the Schnapps will flow under the Kahlua for a clear layer. 3. Again using a spoon, but this time right side up, slowly top off the glass with a layer of Bailey's. Be careful to place the spoon right at the top of the Kahlua layer and to raise it as the glass fills up. Done correctly, this will provide a layer of Bailey's floating over the Kahlua. 4. Toss it down all at once for something like a Peppermint Pattie, WITH A BANG!!! NOTE: Best if all ingredients are chilled"
13056,Wine Cooler,Optional alcohol,Punch / Party Drink,Collins Glass,Mix wine and soft drink. Pour into glass. Add ice.
11053,Arise My Love,Alcoholic,Ordinary Drink,Champagne flute,Put creme de menthe into a champagne flute. Fill with chilled champagne and serve.
12562,Alice Cocktail,Non alcoholic,Cocktail,Cocktail glass,"Shake well, strain into a large cocktail glass."
12704,Limeade,Non alcoholic,Other/Unknown,Highball glass,"In a large glass, put the lime juice and sugar, and stir well. Add cold seltzer water to fill. Put the lime peels in the glass. Drink. Repeat until limes or soda run out."
16986,Bible Belt,Alcoholic,Other/Unknown,Highball glass,"Mix all ingredients, and pour over ice."
14642,Grim Reaper,Alcoholic,Ordinary Drink,Old-fashioned glass,Mix Kahlua and 151 in glass. Quickly add ice and pour grenadine over ice to give ice red tint.
11054,Arthur Tompkins,Alcoholic,Ordinary Drink,Whiskey sour glass,"In a shaker half-filled with ice cubes, combine the gin, Grand Marnier, and lemon juice. Shake well. Strain into a sour glass and garnish with the lemon twist."
14842,Midnight Mint,Alcoholic,Cocktail,Cocktail glass,"If available, rim cocktail (Martini) glass with sugar syrup then dip into chocolate flakes or powder. Add ingredients into shaker with ice. Shake well then strain into cocktail glass."
15330,Orange Crush,Alcoholic,Shot,Shot glass,Add all ingredients to tumbler-Pour as shot
12916,Egg Nog - Healthy,Optional alcohol,Punch / Party Drink,Collins Glass,"Whip egg substitute and sugar together, combine with the two kinds of milk, vanilla, and rum. Mix well. Chill over night. Sprinkle with nutmeg. Makes 6 servings."
16354,Arizona Antifreeze,Alcoholic,Shot,Shot glass,Pour all ingredients into shot glass and slam !!!!
11227,Champagne Cocktail,Alcoholic,Ordinary Drink,Champagne flute,Add dash of Angostura bitter onto sugar cube and drop it into champagne flute. Add cognac followed by gently pouring chilled champagne. Garnish with orange slice and maraschino cherry.
11408,Gin Daisy,Alcoholic,Ordinary Drink,Old-fashioned glass,"In a shaker half-filled with ice cubes, combine the wine, lemon juice, sugar, and grenadine. Shake well. Pour into an old-fashioned glass and garnish with the cherry and the orange slice."
12738,Hot Chocolate to Die for,Non alcoholic,Cocoa,Coffee mug,"Melt the chocolate, butter and vanilla in a double boiler. When just smooth stir in the cream."
12101,Rusty Nail,Alcoholic,Ordinary Drink,Old-fashioned glass,Pour the Scotch and Drambuie into an old-fashioned glass almost filled with ice cubes. Stir well. Garnish with the lemon twist.
13539,Ice Pick #1,Alcoholic,Ordinary Drink,Collins Glass,Put Vodka in glass fill with iced tea. Stir in lemon to taste.
13254,Moscow Mule,Alcoholic,Punch / Party Drink,Copper Mug,Combine vodka and ginger beer in a highball glass filled with ice. Add lime juice. Stir gently. Garnish.
11004,Abilene,Alcoholic,Ordinary Drink,Highball glass,Pour all of the ingredients into a highball glass almost filled with ice cubes. Stir well.
17204,Long Island Iced Tea,Alcoholic,Ordinary Drink,Highball glass,Mix all contents in a highball glass and sitr gently. Add dash of Coca-Cola for the coloring and garnish with lemon or lime twist.
12770,Iced Coffee,Non alcoholic,Coffee / Tea,Coffee mug,Mix together until coffee and sugar is dissolved. Add milk. Shake well. Using a blender or milk shake maker produces a very foamy drink. Serve in coffee mug.
12794,Angelica Liqueur,Alcoholic,Homemade Liqueur,Collins Glass,"Combine all herbs, nuts and spices with vodka in a 1 quart or larger aging container. Cap tightly and shake daily for 2 weeks. Strain through a fine muslin cloth or coffee filter, discarding solids. Clean out aging container. Place liquid back in container. Place sugar and water in saucepan and stir to combine over medium heat. When sugar is completely dissolved, set aside and let cool. When cool combine with food coloring and add to liqueur liquid. Cap and allow to age and mellow in a cool, dark place for one month."
13192,National Aquarium,Alcoholic,Ordinary Drink,Collins Glass,Pour all ingredients into a shaker of ice. Shake well. Serve on the rocks.
12792,Amaretto Liqueur,Alcoholic,Homemade Liqueur,Collins Glass,"Combine sugar and 3/4 cup water in a small saucepan. Bring to a boil, stirring constantly. Reduce heat and simmer until all sugar is dissolved. Remove from heat and cool. In an aging container, combine apricot halves, almond extract, grain alcohol with 1/2 cup water, and brandy. Stir in cooled sugar syrup mixture. Cap and let age for 2 days. Remove apricot halves. (Save apricot halves, can be used for cooking). Add food coloring and glycerine. Stir, recap and continue aging for 1 to 2 months. Re-bottle as desired. Liqueur is ready to serve but will continue to improve with additional aging."
12710,Apple Berry Smoothie,Non alcoholic,Other/Unknown,Highball Glass,Throw everything into a blender and liquify.
13675,Flander's Flake-Out,Alcoholic,Ordinary Drink,Collins Glass,Bang 'em both in.
12089,Rum Old-fashioned,Alcoholic,Ordinary Drink,Old-fashioned glass,"Stir powdered sugar, water, and bitters in an old-fashioned glass. When sugar has dissolved add ice cubes and light rum. Add the twist of lime peel, float 151 proof rum on top, and serve."
12091,Rum Screwdriver,Alcoholic,Ordinary Drink,Highball glass,"Pour rum into a highball glass over ice cubes. Add orange juice, stir, and serve."
12782,Thai Coffee,Non alcoholic,Coffee / Tea,Highball glass,"Place the coffee and spices in the filter cone of your coffee maker. Brew coffee as usual, let it cool. In a tall glass, dissolve 1 or 2 teaspoons of sugar in an ounce of the coffee (it's easier to dissolve than if you put it right over ice). Add 5-6 ice cubes and pour coffee to within about 1 inch of the top of the glass. Rest a spoon on top of the coffee and slowly pour whipping cream into the spoon. This will make the cream float on top of the coffee rather than dispersing into it right away."
17203,Kir,Alcoholic,Ordinary Drink,Wine Glass,"Add the crème de cassis to the bottom of the glass, then top up with wine."
12734,Chocolate Drink,Non alcoholic,Cocoa,Coffee mug,"Melt the bar in a small amount of boiling water. Add milk. Cook over low heat, whipping gently (with a whisk, i would assume) until heated well. Don't let it boil! Serve in coffee mug."
14510,Bailey's Dream Shake,Alcoholic,Soft Drink / Soda,Collins glass,Blend ingredients for 30 seconds. Definitely refreshing for a hot summer's day !
11024,Almond Joy,Alcoholic,Ordinary Drink,Cocktail glass,"Shake all ingredients with ice, strain into a cocktail glass, and serve."
13971,Irish Coffee,Alcoholic,Coffee / Tea,Irish coffee cup,"Heat the coffee, whiskey and sugar; do not boil. Pour into glass and top with cream; serve hot."
13026,Sangria - The World's Best,Alcoholic,Punch / Party Drink,Pitcher,"Mix wine, sugar and fruit, and let sit in the fridge for 18-24 hours. The mixture will have a somewhat syrupy consistency. Before serving stir in brandy and cut the mixture with soda water until it have a thinner, more wine like consistency. Serve from a pitcher in wine glasses."
17181,Dirty Martini,Alcoholic,Cocktail,Cocktail glass,"Pour the vodka, dry vermouth and olive brine into a cocktail shaker with a handful of ice and shake well.
Rub the rim of a martini glass with the wedge of lemon.
Strain the contents of the cocktail shaker into the glass and add the olive.
A dirty Martini contains a splash of olive brine or olive juice and is typically garnished with an olive."
11008,Affair,Alcoholic,Ordinary Drink,Highball glass,"Pour schnapps, orange juice, and cranberry juice over ice in a highball glass. Top with club soda and serve."
12702,Lemouroudji,Non alcoholic,Other/Unknown,Highball Glass,"Juice the lemons. Peel and grate the ginger. Place the grated ginger and a liberal dash of the cayenne pepper into a piece of cheesecloth, and tie it into a knot. Let soak in the water. After 15 minutes or so, add the sugar, and the lemon juice. Chill, and serve."
14688,Freddy Kruger,Alcoholic,Shot,Shot glass,make it an ample size shot!!
15288,252,Alcoholic,Shot,Shot glass,"Add both ingredients to shot glass, shoot, and get drunk quick"
12516,Whiskey Sour,Alcoholic,Ordinary Drink,Old-fashioned glass,"Shake with ice. Strain into chilled glass, garnish and serve. If served 'On the rocks', strain ingredients into old-fashioned glass filled with ice."
17242,Bombay Cassis,Alcoholic,Cocktail,Balloon Glass,"Add the Bombay Sapphire, Crème de Cassis and lime juice to a balloon glass and swirl well to mix.
Fill the glass with good quality cubed ice.
Top up with chilled and freshly opened Fever-Tree Ginger Beer.
Gently stir to combine, top with a gently squeezed lime wedge and finish with a fresh ginger slice."
11145,Classic Old-Fashioned,Alcoholic,Ordinary Drink,Old-fashioned glass,"In an old-fashioned glass, muddle the bitters and water into the sugar cube, using the back of a teaspoon. Almost fill the glass with ice cubes and add the bourbon. Garnish with the orange slice and the cherry. Serve with a swizzle stick."
12988,Mulled Wine,Alcoholic,Punch / Party Drink,Collins Glass,"Simmer 3 cups water with, sugar, cloves, cinnamon sticks, and lemon peel in a stainless steel pot for 10 minutes. Add wine heat to a ""coffee temperature"" (DO NOT BOIL) then add the brandy."
11604,Kentucky Colonel,Alcoholic,Ordinary Drink,Cocktail glass,In a shaker half-filled with ice cubes combine the courbon and Benedictine. Shake and strain into a cocktail glass. Garnish with the lemon twist.
14356,Blind Russian,Alcoholic,Milk / Float / Shake,Collins glass,Fill glass with ice. Add all liquers. Add milk. shake.
13196,Long vodka,Alcoholic,Ordinary Drink,Highball glass,"Shake a tall glass with ice cubes and Angostura, coating the inside of the glass. Por the vodka onto this, add 1 slice of lime and squeeze juice out of remainder, mix with tonic, stir and voila you have a Long Vodka"
11239,Cherry Rum,Alcoholic,Ordinary Drink,Cocktail glass,"Shake all ingredients with ice, strain into a cocktail glass, and serve."
11118,Blue Margarita,Alcoholic,Ordinary Drink,Cocktail glass,"Rub rim of cocktail glass with lime juice. Dip rim in coarse salt. Shake tequila, blue curacao, and lime juice with ice, strain into the salt-rimmed glass, and serve."
17206,Mint Julep,Alcoholic,Ordinary Drink,Collins glass,"In a highball glass gently muddle the mint, sugar and water. Fill the glass with cracked ice, add Bourbon and stir well until the glass is well frosted. Garnish with a mint sprig."
17196,Cosmopolitan,Alcoholic,Cocktail,Cocktail glass,Add all ingredients into cocktail shaker filled with ice. Shake well and double strain into large cocktail glass. Garnish with lime wheel.
12864,Apple Cider Punch #1,Optional alcohol,Punch / Party Drink,Collins Glass,"If you use the whole all spice and cloves, tie them in cheesecloth. Heat the mixture. Stir occasionally. If you want an alcoholic drink, rum would be nice."
17194,White Lady,Alcoholic,Ordinary Drink,Cocktail glass,Add all ingredients into cocktail shaker filled with ice. Shake well and strain into large cocktail glass.
12196,Sidecar,Alcoholic,Ordinary Drink,Cocktail glass,Pour all ingredients into cocktail shaker filled with ice. Shake well and strain into cocktail glass.
14360,Absolut Sex,Alcoholic,Shot,Old-fashioned glass,"Shake Absolut Kurant, Midori, and Cranberry juice in shaker with ice: Strain into rocks glass: Splash of seven on top.Absolut Sex."
17114,Ruby Tuesday,Alcoholic,Cocktail,Highball glass,Pour gin and cranberry into a highball filled with ice cubes. Add grenadine and stir.
12670,Fruit Cooler,Non alcoholic,Other/Unknown,Highball Glass,"Toss strawberries with sugar, and let sit overnight in refrigerator. Cut lemon, reserve two slices. Juice the rest. Mix together the lemon juice, strawberries, apple juice, and soda water. Add slices of lemon (decor, really). In glasses, put ice cubes, and a slice of apple. Pour drink in, and serve."
13938,AT&T,Alcoholic,Ordinary Drink,Highball Glass,"Pour Vodka and Gin over ice, add Tonic and Stir"
11026,Amaretto Mist,Alcoholic,Ordinary Drink,Old-fashioned glass,"Pour amaretto in an old-fashioned glass over crushed ice. Add the wedge of lime and serve. (A wedge of lemon may be substituted for lime, if preferred.)"
15224,Malibu Twister,Alcoholic,Cocktail,Highball glass,"Add rum & trister then, add cranberry jucie,stir"
12708,Banana Cantaloupe Smoothie,Non alcoholic,Other/Unknown,Highball Glass,"Juice cantaloupe, pour juice into blender, add banana, and liquify."
16403,Black and Brown,Alcoholic,Beer,Beer pilsner,CAREFULLY to avoid explosive head formation: Pour Beer glass half full of favorite rootbeer and top off with Guinness.
15549,Negroni,Alcoholic,Ordinary Drink,Old-fashioned glass,"Stir into glass over ice, garnish and serve."
17222,A1,Alcoholic,Cocktail,Cocktail glass,"Pour all ingredients into a cocktail shaker, mix and serve over ice into a chilled glass."
11084,Bermuda Highball,Alcoholic,Ordinary Drink,Highball glass,"Pour brandy, gin, and dry vermouth into a highball glass over ice cubes. Fill with carbonated water and stir. Add the twist of lemon and serve. (Ginger ale may be substituted for carbonated water, if preferred.)"
11205,California Lemonade,Alcoholic,Ordinary Drink,Collins glass,Shake all ingredients (except carbonated water) with ice and strain into a collins glass over shaved ice. Fill with carbonated water and stir. Decorate with slices of orange and lemon. Add the cherry and serve with a straw.
