iddrink,strdrink,stralcoholic,strcategory,strglass,strinstructions
16967,Vodka Fizz,Alcoholic,Other/Unknown,White wine glass,"Blend all ingredients, save nutmeg. Pour into large white wine glass and sprinkle nutmeg on top."
11662,London Town,Alcoholic,Ordinary Drink,Cocktail glass,"In a mixing glass half-filled with ice cubes, combine all of the ingredients. Stir well. Strain into a cocktail glass."
13535,Pink Panty Pulldowns,Alcoholic,Ordinary Drink,Collins Glass,Shake well
12658,Banana Strawberry Shake Daiquiri-type,Non alcoholic,Milk / Float / Shake,Cocktail Glass,Blend all together in a blender until smooth.
17192,Porto flip,Alcoholic,Ordinary Drink,Cocktail glass,"Shake ingredients together in a mixer with ice. Strain into glass, garnish and serve."
13847,Jackhammer,Alcoholic,Ordinary Drink,Collins Glass,"Serve over ice- Warning,Deadly!"
17220,Butter Baby,Alcoholic,Milk / Float / Shake,Beer mug,Blend together in a blender. Serve in a chilled Beer mug with Fresh Blueberries and caramel for topping.
11524,Imperial Fizz,Alcoholic,Ordinary Drink,Highball glass,"Shake all ingredients (except carbonated water) with ice and strain into a highball glass over two ice cubes. Fill with carbonated water, stir, and serve."
12706,Imperial Cocktail,Alcoholic,Cocktail,Cocktail glass,Shake with ice and strain into cocktail glass.
17250,Corpse Reviver #2,Alcoholic,Cocktail,Cocktail glass,"Shake, strain, straight up, cocktail glass rinsed with absinthe
"
13024,Sweet Sangria,Alcoholic,Punch / Party Drink,Pitcher,"Dissolve the sugar in hot water and cool. Peel the citrus fruits and break into wedges. Mix the wine, sugar syrup, fruit, and Fresca in a pitcher and put in the fridge for a few hours. Serve in tall glasses with a straw."
11472,Hawaiian Cocktail,Alcoholic,Ordinary Drink,Cocktail glass,"Shake all ingredients with ice, strain into a cocktail glass, and serve."
12256,Sol Y Sombra,Alcoholic,Ordinary Drink,Brandy snifter,"Shake ingredients with ice, strain into a brandy snifter, and serve. (The English translation of the name of this drink is ""Sun and Shade"", and after sampling this drink, you'll understand why. Thanks, Kirby.)"
11055,Artillery,Alcoholic,Ordinary Drink,Cocktail glass,"Stir all ingredients with ice, strain into a cocktail glass, and serve."
14087,Red Snapper,Alcoholic,Shot,Old-fashioned glass,"One shot each, shake n shoot"
15266,Avalon,Alcoholic,Ordinary Drink,Highball glass,"Fill a tall glass with ice. Layer the Finlandia Vodka, lemon and apple juices, Pisang Ambon, and top up with lemonade. Stir slightly and garnish with a spiralled cucumber skin and a red cherry. The cucumber provides zest and looks attractive. This drink, created by Timo Haimi, took first prize in the 1991 Finlandia Vodka Long Drink Competition."
13389,Snake Bite (UK),Alcoholic,Beer,Pint glass,Pour ingredients into a pint glass. Drink. Fall over.
12188,Sherry Eggnog,Alcoholic,Ordinary Drink,Collins glass,"Shake sherry, powdered sugar, and egg with ice and strain into a collins glass. Fill with milk and stir. Sprinkle nutmeg on top and serve."
13066,Bruce's Puce,Alcoholic,Shot,Shot glass,"In a regular-sized shot glass, layer, with a spoon or cherry, the grenadine , the Kahlua , then the Bailey's Irish cream in equal portions. It goes down really smooth ,and you don't even need a chaser. It tastes just like chocolate milk.(Really!)"
16100,Amaretto Stone Sour #3,Alcoholic,Other/Unknown,Highball glass,"Shake sour mix, tequila and amaretto with ice. Strain into highball glass. Add a splash of OJ. Garnish with orange slice and a cherry."
12402,Tom Collins,Alcoholic,Ordinary Drink,Collins glass,"In a shaker half-filled with ice cubes, combine the gin, lemon juice, and sugar. Shake well. Strain into a collins glass alomst filled with ice cubes. Add the club soda. Stir and garnish with the cherry and the orange slice."
15997,GG,Optional alcohol,Ordinary Drink,Collins Glass,Pour the Galliano liqueur over ice. Fill the remainder of the glass with ginger ale and thats all there is to it. You now have a your very own GG.
17006,Kool First Aid,Alcoholic,Shot,Shot glass,"Add Kool Aid to a double shot glass, and top with rum. Slam and shoot."
11021,Allegheny,Alcoholic,Ordinary Drink,Cocktail glass,Shake all ingredients (except lemon peel) with ice and strain into a cocktail glass. Top with the twist of lemon peel and serve.
16108,9 1/2 Weeks,Alcoholic,Cocktail,Cocktail glass,Combine all ingredients in glass mixer. Chill and strain into Cocktail glass. Garnish with sliced strawberry.
12718,Pineapple Gingerale Smoothie,Non alcoholic,Other/Unknown,Highball Glass,Throw everything into a blender and liquify.
16991,Downshift,Alcoholic,Punch / Party Drink,Hurricane glass,"Start with the Sprite. Next comes the tequila. After that, add the Minute Maid Fruit Punch, then float the 151. Rocks optional."
11410,Gin Fizz,Alcoholic,Ordinary Drink,Highball glass,"Shake all ingredients with ice cubes, except soda water. Pour into glass. Top with soda water."
12362,Tequila Fizz,Alcoholic,Ordinary Drink,Collins glass,"Shake all ingredients (except ginger ale) with ice and strain into a collins glass over ice cubes. Fill with ginger ale, stir, and serve."
11102,Black Russian,Alcoholic,Ordinary Drink,Old-fashioned glass,Pour the ingredients into an old fashioned glass filled with ice cubes. Stir gently.
17118,Arctic Mouthwash,Alcoholic,Punch / Party Drink,Cocktail glass,Blend all ingredients in a blender on high until ice is finely crushed. It should be of a slushy consistency. Pour immediately and serve.
13861,Nutty Irishman,Alcoholic,Milk / Float / Shake,Highball Glass,Serve over ice
17252,Greyhound,Alcoholic,Cocktail,Collins glass,"1. Add the vodka to a Collins glass filled with ice.
2. Top with grapefruit juice and stir.

"
17094,Alice in Wonderland,Alcoholic,Ordinary Drink,Collins Glass,Just mix the three ingredients one to one to one
16047,Campari Beer,Alcoholic,Beer,Beer mug,Use a 15 oz glass. Add Campari first. Fill with beer.
13899,3 Wise Men,Alcoholic,Shot,Collins glass,put them them in a glass... and slam it to tha head.
15801,Zimadori Zinger,Alcoholic,Punch / Party Drink,Collins glass,Pour Zima in a collins glass over ice and then pour the shot of Midori. Don't stir. Garnish with a cherry.
16990,Sweet Tooth,Alcoholic,Milk / Float / Shake,Highball Glass,"Put 2 shots Godiva Liquour into a glass, add as much or as little milk as you would like."
17195,Bellini,Alcoholic,Ordinary Drink,Champagne Flute,"Pour peach purée into chilled flute, add sparkling wine. Stir gently."
14782,Hot Creamy Bush,Alcoholic,Coffee / Tea,Irish coffee cup,Combine all ingredients in glass
14610,ACID,Alcoholic,Shot,Shot glass,Poor in the 151 first followed by the 101 served with a Coke or Dr Pepper chaser.
13200,Owen's Grandmother's Revenge,Alcoholic,Ordinary Drink,Highball glass,Add ingredients and mix in blender.
14578,Amaretto Sunrise,Alcoholic,Ordinary Drink,Collins Glass,Mix together the amaretto and orange juice. Pour into glass and then add the grenadine untill you see the sunrise.
11112,Bloody Maria,Alcoholic,Ordinary Drink,Old-fashioned glass,Shake all ingredients (except lemon slice) with cracked ice and strain into an old-fashioned glass over ice cubes. Add the slice of lemon and serve.
17217,Vampiro,Alcoholic,Ordinary Drink,Old-Fashioned glass,"Vampiros may be made in a tall glass or an old fashioned glass. Bartenders may first ""rim"" the glass with Kosher Salt, which is done by placing a layer of Kosher Salt on a chopping board, moistening the glass' rim with lime juice or water, and then placing the upside down glass rim onto the Kosher Salt, so that the salt sticks to the moistened rim. The second step is to fill half the glass with ice and add one or two shooter glasses full of high quality Tequila. The next stage is to add the flavouring elements. This is done by squeezing a fresh lime into the glass, adding a few grains of salt, adding citrus-flavoured soda pop, until the glass is 4/5 full, and then adding spicy Viuda de Sanchez (or orange juice, lime juice and pico de gallo). The final step is to stir the ingredients so that the flavours are properly blended."
12876,Berry Deadly,Alcoholic,Punch / Party Drink,Collins Glass,Add all ingredients to large bowl. Stir gently. Serve chilled.
12762,Grizzly Bear,Alcoholic,Ordinary Drink,Collins Glass,"Served over ice. Sounds nasty, but tastes great."
11666,Lone Tree Cooler,Alcoholic,Ordinary Drink,Collins glass,"Stir powdered sugar and 2 oz. carbonated water in a collins glass. Fill glass with ice, add gin and vermouth, and stir. Fill with carbonated water and stir again. Add the twist of lemon peel and the orange spiral so that the end dangles over rim of glass."
17035,Buccaneer,Alcoholic,Beer,Beer pilsner,Pour the corona into an 18oz beer glass pour the bacardi limon into the beer stir very gently
17227,Addington,Alcoholic,Cocktail,Cocktail glass,Mix both the vermouth's in a shaker and strain into a cold glass. Top up with a squirt of Soda Water. 
17105,501 Blue,Alcoholic,Ordinary Drink,Collins Glass,Mix equal amounts into a glass with ice.
16134,Absolutly Screwed Up,Alcoholic,Cocktail,Collins glass,"Shake it up it tasts better that way, but you can stir it if you want. 6 of those and you will be wasted for the rest of the night."
13042,Sunny Holiday Punch,Optional alcohol,Punch / Party Drink,Punch bowl,Combine all ingredients in a punch bowl.
15300,3-Mile Long Island Iced Tea,Alcoholic,Ordinary Drink,Collins Glass,Fill 14oz glass with ice and alcohol. Fill 2/3 glass with cola and remainder with sweet & sour. Top with dash of bitters and lemon wedge.
13405,Brainteaser,Alcoholic,Shot,Shot Glass,"layered erin first, then sambuca and then avocart(should sit in middle of other two. To drink: use a straw to suck up avocart then shot the rest and then suck fumes up through straw."
17167,Raspberry Cooler,Alcoholic,Other/Unknown,Highball glass,Pour the raspberry vodka and soda into a highball glass almost filled with ice cubes. Stir well.
11147,Bourbon Sour,Alcoholic,Ordinary Drink,Whiskey sour glass,"In a shaker half-filled with ice cubes, combine the bourbon, lemon juice, and sugar. Shake well. Strain into a whiskey sour glass, garnish with the orange slice and cherry."
17241,Zombie,Alcoholic,Cocktail,Hurricane glass,"
Blend at high speed for no more than 5 seconds.

Pour into a glass, add ice cubes to fill, then add the garnish.

*Donn’s mix: Bring 3 crushed cinnamon sticks, 1 cup of sugar and 1 cup of water to a boil, stirring until the sugar is dissolved.

Simmer for 2 minutes, then remove from the heat and let sit for at least 2 hours before straining into a clean glass bottle.

Then add 1 part of the syrup and 2 parts of fresh grapefruit juice together."
11255,Clove Cocktail,Alcoholic,Ordinary Drink,Cocktail glass,"Stir all ingredients with ice, strain into a cocktail glass, and serve."
16202,Amaretto Sweet & Sour,Alcoholic,Punch / Party Drink,Margarita/Coupette glass,"Fill the blender with 3/4 ice. Add sweet & sour mix to the top of the ice. Add about 1"" of pineapple juice, 1/2"" of melon liqeur, and 1/2 to 1/4"" of amaretto. Then blend the mix until it is of margaritta consistency or thinner."
17135,Citrus Coke,Alcoholic,Soft Drink / Soda,Highball Glass,Pour half of coke in a glass. Then add Bacardi and top it off with the remaining coke. Stir and drink up!
14209,Mocha-Berry,Alcoholic,Coffee / Tea,Irish coffee cup,"pour 6 oz. of coffee in a mug or Irish coffee cup. add coca mix and chambord, mix well and top off with whipped cream."
12071,Rum Cooler,Alcoholic,Ordinary Drink,Collins glass,Pour the rum and soda into a collins glass almost filled with ice cubes. Stir well and garnish with the lemon wedge.
14588,151 Florida Bushwacker,Alcoholic,Milk / Float / Shake,Beer mug,Combine all ingredients. Blend until smooth. Garnish with chocolate shavings if desired.
11243,Chocolate Black Russian,Alcoholic,Ordinary Drink,Champagne flute,Combine all ingredients in an electric blender and blend at a low speed for a short length of time. Pour into a chilled champagne flute and serve.
12720,Kill the cold Smoothie,Non alcoholic,Other/Unknown,Highball glass,Juice ginger and lemon and add it to hot water. You may add cardomom.
12910,Egg Nog #4,Optional alcohol,Punch / Party Drink,Punch bowl,"In a small mixer bowl beat egg yolks till blended. Gradually add 1/4 cup sugar, beating at high speed till thick and lemon colored. Stir in milk, stir in rum, bourbon, vanilla, and salt. Chill thoroughly. Whip cream. Wash beaters well. In a large mixer bowl beat egg whites till soft peaks form. Gradually add remaining 1/4 cup sugar, beating to stiff peaks. Fold yolk mixture and whipped cream into egg whites. Serve immediately. Sprinkle nutmeg over each serving. Serve in a punch bowl or another big bowl. NOTE: For a nonalcoholic eggnog, prepare Eggnog as above, except omit the bourbon and rum and increase the milk to 3 cups."
11390,Frozen Mint Daiquiri,Alcoholic,Ordinary Drink,Old-fashioned glass,Combine all ingredients with 1 cup of crushed ice in an electric blender. Blend at a low speed for a short length of time. Pour into an old-fashioned glass and serve.
11129,Boston Sour,Alcoholic,Ordinary Drink,Whiskey sour glass,"Shake juice of lemon, powdered sugar, blended whiskey, and egg white with cracked ice and strain into a whiskey sour glass. Add the slice of lemon, top with the cherry, and serve."
13204,New York Lemonade,Alcoholic,Cocktail,Cocktail glass,Serve in a chilled cocktail glass. Lemon and sugar the rim. Stir and Strain.
12560,Afterglow,Non alcoholic,Cocktail,Highball Glass,Mix. Serve over ice.
11202,Caipirinha,Alcoholic,Ordinary Drink,Old-fashioned glass,Place lime and sugar into old fashioned glass and muddle (mash the two ingredients together using a muddler or a wooden spoon). Fill the glass with ice and add the Cachaça.
17249,Pegu Club,Alcoholic,Cocktail,Cocktail glass,"Shake, strain, up, cocktail glass"
11320,Dragonfly,Alcoholic,Ordinary Drink,Highball glass,"In a highball glass almost filled with ice cubes, combine the gin and ginger ale. Stir well. Garnish with the lime wedge."
11146,Bourbon Sling,Alcoholic,Ordinary Drink,Highball glass,"In a shaker half-filled with ice cubes, combine the sugar, water, lemon juice, and bourbon. Shake well. Strain well. Strain into a highball glass. Garnish with the lemon twist."
17015,Irish Russian,Alcoholic,Beer,Highball glass,Add the ingredients in the order listed in the recipe. Care must be taken when adding the Guinness to prevent an excess of foam. Do Not add ice.
17223,Abbey Martini,Alcoholic,Cocktail,Cocktail glass,"Put all ingredients into a shaker and mix, then strain contents into a chilled cocktail glass."
12444,Vesuvio,Alcoholic,Ordinary Drink,Old-fashioned glass,"Shake all ingredients with ice, strain into an old-fashioned glass over ice cubes, and serve."
11419,Gin Swizzle,Alcoholic,Ordinary Drink,Highball glass,"In a shaker half-filled with ice cubes, combine the lime juice, sugar, gin, and bitters. Shake well. Almost fill a colling glass with ice cubes. Stir until the glass is frosted. Strain the mixture in the shaker into the glass and add the club soda."
12452,Victory Collins,Alcoholic,Ordinary Drink,Collins glass,Shake all ingredients (except orange slice) with ice and strain into a collins glass over ice cubes. Add the slice of orange and serve.
17253,Paloma,Alcoholic,Cocktail,Collins glass,Stir together and serve over ice.
14538,Bumble Bee #1,Alcoholic,Shot,Shot glass,"This is a layered shot. First pour the Bailey's into the shot glass. Then take an upside down spoon and touch it to the inside wall of the glass. Carefully add the Kahlua. Repeat this process for the Sambuca. If done properly, the alcohol will stay separated and resemble a bumble bee. Enjoy!!!"
11798,Monkey Wrench,Alcoholic,Ordinary Drink,Old-fashioned glass,Pour all of the ingredients into an old-fashioned glass almost filled with ice cubes. Stir well.
12736,Drinking Chocolate,Non alcoholic,Cocoa,Coffee mug,"Heat the cream and milk with the cinnamon and vanilla bean very slowly for 15-20 minutes. (If you don't have any beans add 1-2 tsp of vanilla after heating). Remove the bean and cinnamon. Add the chocolate. Mix until fully melted. Serve topped with some very dense fresh whipped cream. Serves 1-2 depending upon how much of a glutton you are. For a richer chocolate, use 4 oz of milk, 4 oz of cream, 4 oz of chocolate. Serve in coffee mug."
16963,Zorbatini,Alcoholic,Cocktail,Cocktail glass,Prepare like a Martini. Garnish with a green olive.
13194,Damned if you do,Alcoholic,Shot,Shot glass,Pour into shot glass. Put in mouth. Repeat as deemed necessary.
11391,Frozen Pineapple Daiquiri,Alcoholic,Ordinary Drink,Champagne flute,Combine all ingredients with 1 cup of crushed ice in an electric blender. Blend at a low speed for a short length of time. Pour into a champagne flute and serve.
12694,Lassi Raita,Non alcoholic,Other/Unknown,Highball Glass,"Blend the yoghurt and ice cubes together, until the yoghurt becomes more liquid. Add sugar to taste. The lemon/lime is optional but it gives it a slightly tart taste. Dash of salt. Raita is also good for the summer. Instead of having a traditional salad you can make raita instead."
16985,Shot-gun,Alcoholic,Shot,Shot glass,Pour one part Jack Daneils and one part Jim Beam into shot glass then float Wild Turkey on top.
15597,Absolut Stress #2,Alcoholic,Ordinary Drink,Collins Glass,Mix well. Garnish with Orange and Cherry. Enjoy
14366,Lemon Drop,Alcoholic,Cocktail,Cocktail glass,Shake and strain into a chilled cocktail glass rimmed with sugar.
17180,Aviation,Alcoholic,Cocktail,Cocktail glass,Add all ingredients into cocktail shaker filled with ice. Shake well and strain into cocktail glass. Garnish with a cherry.
12674,Fruit Shake,Non alcoholic,Other/Unknown,Highball Glass,Blend til smooth.
17190,Paradise,Alcoholic,Ordinary Drink,Cocktail glass,Shake together over ice. Strain into cocktail glass and serve chilled.
11786,Mississippi Planters Punch,Alcoholic,Ordinary Drink,Collins glass,"Shake all ingredients (except carbonated water) with ice and strain into a collins glass over ice cubes. Fill with carbonated water, stir, and serve."
11003,Abbey Cocktail,Alcoholic,Ordinary Drink,Cocktail glass,Shake all ingredients (except for the cherry) with ice and strain into a cocktail glass. Top with the cherry and serve.
13328,Chocolate Milk,Alcoholic,Shot,Shot Glass,"Put the milk in the bottom, pour the Liquer on top and add the dash of amaretto. Do not mix. SLAM IT!"
13581,410 Gone,Alcoholic,Ordinary Drink,Collins Glass,
11602,Kentucky B And B,Alcoholic,Ordinary Drink,Brandy snifter,Pour the bourbon and Benedictine into a brandy snifter.
15427,Grand Blue,Alcoholic,Ordinary Drink,Old-fashioned glass,Serve in an old fashioned glass.
14095,Jamaica Kiss,Alcoholic,Milk / Float / Shake,Hurricane glass,Fill a tumbler with ice cubes. Add a shot of Tia Maria and a shot of Jamaican light rum. Fill the tumbler with milk. Blend until smooth and serve immediately.
12790,Absinthe #2,Alcoholic,Homemade Liqueur,Jar,"Mix together and let sit a few days. Strain through a coffee filter. To serve mix 1 part absinthe to 4 parts water, add ice, enjoy."
14167,Vodka Martini,Alcoholic,Ordinary Drink,Cocktail glass,"Shake the vodka and vermouth together with a number of ice cubes, strain into a cocktail glass, add the olive and serve."
11993,Quentin,Alcoholic,Ordinary Drink,Cocktail glass,"In a shaker half-filled with ice cubes, combine the rum, Kahlua, and cream. Shake well. Strain into a cocktail glass and garnish with the nutmeg."
13332,B-53,Alcoholic,Shot,Collins Glass,"Layer the Kahlua, Sambucca and Grand Marnier into a shot glas in that order. Better than B-52"
11670,Lord And Lady,Alcoholic,Ordinary Drink,Old-fashioned glass,Pour the rum and Tia Maria into an old-fashioned glass almost filled with ice cubes. Stir well.
11117,Blue Lagoon,Alcoholic,Ordinary Drink,Highball glass,"Pour vodka and curacao over ice in a highball glass. Fill with lemonade, top with the cherry, and serve."
13036,Strawberry Lemonade,Non alcoholic,Punch / Party Drink,Collins Glass,Throw everything into a blender and mix until fairly smooth. Serve over ice.
14378,Lunch Box,Alcoholic,Beer,Pint glass,Fill a pint glass almost full with beer. Then fill the rest with orange juice (careful not to fill it to the top). Then take the shot of Amaretto and drop it in.
15254,Zenmeister,Alcoholic,Ordinary Drink,Collins Glass,Mix together and enjoy
15675,A midsummernight dream,Alcoholic,Ordinary Drink,Collins Glass,"Mix the strawberrys in a blender Pour it together with the vodka,kirch and strawberry liquer over ice in a shaker. Shake well and pour in a highballglass. Fill up with the Russchian water"
12224,Sloe Gin Cocktail,Alcoholic,Ordinary Drink,Cocktail glass,"Stir all ingredients with ice, strain into a cocktail glass, and serve."
12186,Shanghai Cocktail,Alcoholic,Ordinary Drink,Cocktail glass,"Shake all ingredients with ice, strain into a cocktail glass, and serve."
12712,Grape lemon pineapple Smoothie,Non alcoholic,Other/Unknown,Highball glass,Throw everything into a blender and liquify.
11936,Pink Gin,Alcoholic,Ordinary Drink,White wine glass,"Pour the bitters into a wine glass. Swirl the glass to coat the inside with the bitters, shake out the excess. Pour the gin into the glass. Do not add ice."
11542,Jack Rose Cocktail,Alcoholic,Ordinary Drink,Cocktail glass,"Shake all ingredients with ice, strain into a cocktail glass, and serve."
11121,Bobby Burns Cocktail,Alcoholic,Ordinary Drink,Cocktail glass,Stir all ingredients (except lemon peel) with ice and strain into a cocktail glass. Add the twist of lemon peel and serve.
12107,Salty Dog,Alcoholic,Ordinary Drink,Highball glass,"Pour all ingredients over ice cubes in a highball glass. Stir well and serve. (Vodka may be substituted for gin, if preferred.)"
17256,Martinez 2,Alcoholic,Cocktail,Cocktail glass,"Add all ingredients to a mixing glass and fill with ice.

Stir until chilled, and strain into a chilled coupe glass."
14282,California Root Beer,Alcoholic,Soft Drink / Soda,Highball glass,Put Kahlua and Galliano in highball glass fill with soda
11029,Amaretto Tea,Alcoholic,Ordinary Drink,Pousse cafe glass,"Pour hot tea into a pousse-cafe glass, using a spoon in glass to prevent cracking. Add amaretto, but do not stir. Top with chilled whipped cream and serve."
12854,Scottish Highland Liqueur,Alcoholic,Homemade Liqueur,Collins Glass,"Combine all ingreds in aging container. Cover tightly and shake gently several times during the first 24 hrs. After 24 hrs, remove the lemon zest. Cover again and let stand in a cool, dark place for 2 weeks, shaking gently every other day. Strain through a wire sieve to remove the angelica root and fennel. Return to aging container, cover and let stand undisturbed in a cool dark place for 6 months. Siphon or pour clear liqueur into a sterile bottle. The cloudy dregs may be saved for cooking."
11379,"French ""75""",Alcoholic,Ordinary Drink,Collins glass,"In a shaker half-filled with ice cubes, combine the gin, sugar, and lemon juice. Shake well. Pour into a collins glass. Top with the Champagne. Stir well and garnish with the orange slice and the cherry."
17065,Caribbean Boilermaker,Alcoholic,Beer,Beer pilsner,Pour the Corona into an 18oz beer glass pour the rum into the beer.
12572,Bora Bora,Non alcoholic,Cocktail,Highball glass,"Prepare in a blender or shaker, serve in a highball glass on the rocks. Garnish with 1 slice of pineapple and one cherry."
12564,Apple Karate,Non alcoholic,Cocktail,Highball Glass,"Place all ingredients in the blender jar - cover and whiz on medium speed until well blended. Pour in one tall, 2 medium or 3 small glasses and drink up."
11422,Godchild,Alcoholic,Ordinary Drink,Champagne flute,"Shake all ingredients well with cracked ice, strain into a champagne flute, and serve."
13427,Mojito,Alcoholic,Cocktail,Highball glass,Muddle mint leaves with sugar and lime juice. Add a splash of soda water and fill the glass with cracked ice. Pour the rum and top with soda water. Garnish and serve with straw.
11222,Casa Blanca,Alcoholic,Ordinary Drink,Cocktail glass,"Shake all ingredients with ice, strain into a cocktail glass, and serve."
11961,Port And Starboard,Alcoholic,Ordinary Drink,Pousse cafe glass,"Pour carefully into a pousse-cafe glass, so that creme de menthe floats on grenadine. Serve without mixing."
12127,Sazerac,Alcoholic,Ordinary Drink,Old-fashioned glass,"Rinse a chilled old-fashioned glass with the absinthe, add crushed ice, and set it aside. Stir the remaining ingredients over ice and set it aside. Discard the ice and any excess absinthe from the prepared glass, and strain the drink into the glass. Add the lemon peel for garnish."
11060,Balmoral,Alcoholic,Ordinary Drink,Cocktail glass,"In a mixing glass half-filled with ice cubes, combine all of the ingredients. Stir well. Strain into a cocktail glass."
13086,Atomic Lokade,Alcoholic,Ordinary Drink,Collins Glass,"In a shaker, place lemonade, vodka, blue Curacao, and triple sec together. Shake with ice and strain into glass. Add sugar to taste"
11634,Lady Love Fizz,Alcoholic,Ordinary Drink,Cocktail glass,"Shake all ingredients (except carbonated water) with ice and strain into a cocktail glass over two ice cubes. Fill with carbonated water, stir, and serve."
17027,Zima Blaster,Alcoholic,Ordinary Drink,Hurricane glass,"Fill glass with ice. Pour in Chambord, then fill with Zima. Mix and enjoy."
